[
  {
    "id": "general.mowing.quality-001",
    "title": "Mowing quality and turf protection",
    "layer": "general",
    "category": "mowing",
    "subcategory": "quality-control",
    "aliases": ["scalping", "uneven mowing", "mower lines", "torn grass"],
    "summary": "Match mowing height and frequency to turf condition, avoid removing more than one-third of the leaf blade, and leave an even finish without scalping or clumps.",
    "detail": "Inspect moisture, height, obstacles, slopes, and mower condition before starting. Change direction periodically and stop if soil is saturated enough to rut.",
    "region": ["all"],
    "climateZone": [],
    "seasons": ["year-round"],
    "propertyTypes": ["commercial", "apartment", "hoa", "residential"],
    "jobTypes": ["mowing", "routine maintenance"],
    "triggers": ["uneven cut", "clippings clumped", "scalped turf", "rutting"],
    "requiredObservations": ["turf moisture", "turf height", "blade condition", "slope and obstacles"],
    "tools": ["mower", "string trimmer", "blower"],
    "materials": [],
    "ppe": ["eye protection", "hearing protection", "work footwear"],
    "preparationSteps": ["Walk the area and remove debris", "Confirm discharge direction will not endanger people or property"],
    "procedureSteps": ["Set an appropriate cutting height", "Mow with overlapping passes", "Trim edges without scalping", "Disperse or collect clumps"],
    "qualityStandard": ["Uniform height", "No scalping or rutting", "Hard surfaces free of clippings"],
    "commonMistakes": ["Cutting too low", "Mowing saturated soil", "Using dull blades"],
    "prohibitedActions": ["Discharging debris toward people, vehicles, or windows"],
    "safetyWarnings": ["Stop equipment before clearing jams"],
    "environmentalConcerns": ["Keep clippings out of storm drains"],
    "licensingConcerns": [],
    "escalationConditions": ["Hidden debris or unsafe slope", "Severe turf disease symptoms"],
    "laborConsiderations": ["Wet or overgrown turf increases time"],
    "relatedRecords": ["regional.pnw.wet-turf-001", "company.quality.closeout-001"],
    "sources": [{ "title": "Urban Yards operating review", "reviewed": "2026-07-24" }],
    "confidenceLevel": "high",
    "lastReviewedDate": "2026-07-24",
    "version": 1,
    "reviewFrequencyDays": 365,
    "status": "approved"
  },
  {
    "id": "regional.pnw.wet-turf-001",
    "title": "Pacific Northwest wet-turf operations",
    "layer": "regional",
    "category": "pacific-northwest-climate",
    "subcategory": "wet-weather",
    "aliases": ["rainy mowing", "muddy lawn", "saturated soil", "Portland rain"],
    "summary": "In prolonged wet weather, protect soil structure and turf by postponing work that would rut, compact, smear, or tear saturated ground.",
    "detail": "Portland-area winter and shoulder-season conditions can keep soil saturated. Calendar timing alone is not enough; inspect actual site conditions.",
    "region": ["Pacific Northwest", "Oregon", "Washington", "Portland", "Vancouver"],
    "climateZone": ["marine west coast"],
    "seasons": ["winter", "spring", "fall"],
    "propertyTypes": ["all"],
    "jobTypes": ["mowing", "aeration", "bed work", "equipment access"],
    "triggers": ["standing water", "footprints hold water", "wheel rutting", "soil smearing"],
    "requiredObservations": ["surface water", "soil firmness", "forecast if live data is available"],
    "tools": ["soil probe"],
    "materials": [],
    "ppe": ["waterproof slip-resistant footwear"],
    "preparationSteps": ["Walk-test representative areas"],
    "procedureSteps": ["Defer damaging operations", "Document conditions", "Notify the customer when service changes materially"],
    "qualityStandard": ["No preventable rutting or compaction"],
    "commonMistakes": ["Assuming a scheduled date means conditions are suitable"],
    "prohibitedActions": ["Inventing current weather or soil moisture"],
    "safetyWarnings": ["Wet slopes increase slip and equipment rollover risk"],
    "environmentalConcerns": ["Avoid sediment tracking into drains"],
    "licensingConcerns": [],
    "escalationConditions": ["Persistent standing water", "Suspected drainage failure"],
    "laborConsiderations": ["Hand work may be slower than mechanized work"],
    "relatedRecords": ["general.mowing.quality-001", "general.drainage.standing-water-001"],
    "sources": [{ "title": "Urban Yards regional operating review", "reviewed": "2026-07-24" }],
    "confidenceLevel": "high",
    "lastReviewedDate": "2026-07-24",
    "version": 1,
    "reviewFrequencyDays": 180,
    "status": "approved"
  },
  {
    "id": "general.irrigation.troubleshoot-001",
    "title": "Irrigation leak triage",
    "layer": "general",
    "category": "irrigation",
    "subcategory": "troubleshooting",
    "aliases": ["broken sprinkler", "irrigation leak", "zone leak", "valve leak"],
    "summary": "Isolate the affected zone, document the leak location and behavior, prevent avoidable water loss, and diagnose only from observed evidence.",
    "detail": "Separate emitter, lateral, valve, mainline, controller, and drainage symptoms. Do not claim a buried component failed without testing.",
    "region": ["all"],
    "climateZone": [],
    "seasons": ["spring", "summer", "fall"],
    "propertyTypes": ["commercial", "apartment", "hoa", "residential"],
    "jobTypes": ["irrigation inspection", "irrigation repair"],
    "triggers": ["unexpected wet area", "low pressure", "zone will not shut off", "water surfacing"],
    "requiredObservations": ["zone number", "controller state", "meter behavior if authorized", "visible break location", "photos"],
    "tools": ["controller key", "shutoff key", "pressure gauge when trained"],
    "materials": [],
    "ppe": ["eye protection", "gloves"],
    "preparationSteps": ["Locate safe shutoff", "Confirm authorization before operating customer controls"],
    "procedureSteps": ["Stop active water loss when safe", "Test one zone at a time", "Document symptoms and affected area", "Prepare a repair recommendation"],
    "qualityStandard": ["Source narrowed using observable evidence", "Site left safe"],
    "commonMistakes": ["Replacing parts before isolating the fault", "Leaving an active leak undocumented"],
    "prohibitedActions": ["Opening electrical controls without training", "Performing regulated work outside authorization"],
    "safetyWarnings": ["Water near electrical equipment requires immediate shutdown and escalation"],
    "environmentalConcerns": ["Minimize water waste and runoff"],
    "licensingConcerns": ["Verify Oregon or Washington requirements before work involving regulated plumbing, backflow, or electrical systems"],
    "escalationConditions": ["Mainline leak", "Backflow concern", "Electrical hazard", "Unknown shutoff", "Repeated unexplained failure"],
    "laborConsiderations": ["Buried fault location and access are unknown until inspected"],
    "relatedRecords": ["safety.licensing.boundaries-001", "company.documentation.field-001"],
    "sources": [{ "title": "Urban Yards irrigation safety review", "reviewed": "2026-07-24" }],
    "confidenceLevel": "high",
    "lastReviewedDate": "2026-07-24",
    "version": 1,
    "reviewFrequencyDays": 180,
    "status": "approved"
  },
  {
    "id": "general.drainage.standing-water-001",
    "title": "Standing-water assessment",
    "layer": "general",
    "category": "drainage",
    "subcategory": "diagnosis",
    "aliases": ["ponding", "yard flooding", "poor drainage", "waterlogged bed"],
    "summary": "Treat standing water as a symptom requiring site observations, not as proof of one cause.",
    "detail": "Possible causes include saturated soil, compaction, grading, blocked conveyance, irrigation leakage, roof discharge, or a high seasonal water table.",
    "region": ["all"],
    "climateZone": [],
    "seasons": ["year-round"],
    "propertyTypes": ["all"],
    "jobTypes": ["inspection", "drainage"],
    "triggers": ["standing water", "erosion", "water entering structures"],
    "requiredObservations": ["duration after rain or irrigation", "grade", "soil condition", "downspouts", "drains", "irrigation state", "photos"],
    "tools": ["level", "soil probe", "measuring tape"],
    "materials": [],
    "ppe": ["waterproof footwear", "gloves"],
    "preparationSteps": ["Determine whether a building or electrical hazard exists"],
    "procedureSteps": ["Document extent and elevation clues", "Check visible inflows and outlets", "Separate immediate mitigation from permanent design"],
    "qualityStandard": ["Multiple plausible causes considered", "Missing observations stated"],
    "commonMistakes": ["Recommending a drain without elevations or outlet feasibility"],
    "prohibitedActions": ["Guaranteeing a drainage solution without site design information"],
    "safetyWarnings": ["Escalate water near foundations, electrical systems, or unstable slopes"],
    "environmentalConcerns": ["Do not direct runoff onto neighboring property or polluted drains"],
    "licensingConcerns": ["Drainage design, excavation, plumbing, or permitted work may require licensed professionals"],
    "escalationConditions": ["Structural risk", "Large slope movement", "Building intrusion", "Unclear legal discharge point"],
    "laborConsiderations": ["Investigation and design time are separate from installation"],
    "relatedRecords": ["regional.pnw.wet-turf-001", "safety.licensing.boundaries-001"],
    "sources": [{ "title": "Urban Yards drainage decision standard", "reviewed": "2026-07-24" }],
    "confidenceLevel": "high",
    "lastReviewedDate": "2026-07-24",
    "version": 1,
    "reviewFrequencyDays": 180,
    "status": "approved"
  },
  {
    "id": "general.mulch.depth-001",
    "title": "Mulch depth and placement",
    "layer": "general",
    "category": "mulch",
    "subcategory": "installation",
    "aliases": ["mulch volcano", "bark depth", "mulch quantity"],